{
  "id": "prog.a1b2c3",
  "entity_type": "progress_record",
  "schema_version": "1.0.0",
  "learner_id": "user.demo",
  "target_ref": {
    "entity_type": "problem",
    "id": "prob.nt.sum-two-squares-mod4"
  },
  "interaction_type": "attempt",
  "outcome": "partial",
  "occurred_at": "2026-03-08T10:00:00Z",
  "time_spent_seconds": 420,
  "score": 0.5,
  "audit": {
    "created_at": "2026-03-08T10:00:00Z",
    "updated_at": "2026-03-08T10:05:00Z",
    "created_by": "system.seed",
    "updated_by": "system.seed"
  }
}
